Title,Description,URL,Date,Sentiment
Machine learning - Wikipedia,Statistics and mathematical optimization (mathematical programming) methods comprise the foundations of machine learning. Data mining is a related field of ...,https://en.wikipedia.org/wiki/Machine_learning,N/A,NEUTRAL
What Is Machine Learning (ML)? | IBM,Machine learning (ML) is a branch of AI and computer science that focuses on the using data and algorithms to enable AI to imitate the way that humans ...,https://www.ibm.com/think/topics/machine-learning,N/A,NEUTRAL
Supervised Machine Learning: Regression and Classification ...,"Build & train supervised machine learning models for prediction & binary classification tasks, including linear regression & logistic regression.",https://www.coursera.org/learn/machine-learning,N/A,NEUTRAL
Machine Learning | Google for Developers,"Machine Learning Crash Course. Google's fast-paced, practical introduction to machine learning, featuring a series of lessons with video lectures, interactive ...",https://developers.google.com/machine-learning/crash-course,N/A,NEUTRAL
"Machine learning, explained | MIT Sloan","Apr 21, 2021 ... Machine learning is a subfield of artificial intelligence, which is broadly defined as the capability of a machine to imitate intelligent human ...",https://mitsloan.mit.edu/ideas-made-to-matter/machine-learning-explained,N/A,NEUTRAL
Machine Learning,"Jul 29, 2009 ... Original Design · Overall Strategy · Observation/Action Space · Other interesting details · Less interesting details/thoughts · Future Ideas.",https://www.reddit.com/r/MachineLearning/,N/A,NEUTRAL
Machine Learning (ML) on AWS - ML Models and Tools - AWS,"Machine learning on AWS. AWS helps you innovate with machine learning (ML) at scale with the most comprehensive set of ML services, infrastructure, and ...",https://aws.amazon.com/ai/machine-learning/,N/A,POSITIVE
Machine Learning Tutorial - GeeksforGeeks,"3 days ago ... Machine learning, a subset of Artificial Intelligence, allows computers to learn from data and make predictions through various methods ...",https://www.geeksforgeeks.org/machine-learning/,N/A,NEUTRAL
Machine Learning - CMU - Carnegie Mellon University | @mldcmu,Machine Learning (ML) is a fascinating field of Artificial Intelligence (AI) research and practice where we investigate how computer agents can improve their ...,https://www.ml.cmu.edu/,N/A,NEUTRAL
Machine Learning: What it is and why it matters | SAS,What it is and why it matters. Machine learning is a method of data analysis that automates analytical model building. It is a branch of artificial intelligence ...,https://www.sas.com/en_us/insights/analytics/machine-learning.html,N/A,NEUTRAL
